Timestamp,ROLL_NUMBER,NAME,CLASS,YEAR,EMAIL,DOB,DEPARTMENT,CLASS_ADVISOR,MODE
10/4/2024 21:24:59,22ADR110,Thissyakkanna S M ,AIDS-B,III,thissyakkannasm.22aid@kongu.edu,2/3/2005,AIDS,VIMALA DEVI,HOSTELER
10/4/2024 21:28:50,22ADR083,RAGAV R,AIDS-B,3,ragavr.22aid@kongu.edu,10/17/2024,B TECH ARTIFICIAL INTELLIGENCE AND DATA SCIENCE,VIMALA DEVI,DAYSCHOLAR
10/4/2024 21:29:01,22ADR066 ,mohammed sameer B,AIDS -B,3,mohammedsameerb.22aid@kongu.edu,1/28/2005,Artificial intelligence and data science ,VIMALA DEVI,HOSTELER
10/4/2024 21:30:04,22ADR123,YASHICA S,AIDS B,3,yashicas.22aid@kongu.edu,11/15/2004,AIDS,VIMALA DEVI,HOSTELER
10/4/2024 21:32:19,22ADR099,Shahidkhan S,AIDS-B,3,shahidkhans.22aid@kongu.edu,9/16/2004,ARTIFICIAL INTELLIGENCE AND DATA SCIENCE,VIMALA DEVI,HOSTELER
10/4/2024 21:35:29,22ADR090,SAKTHIVEL K ,AIDS-B,3,sakthivelk.22aid@kongu.edu,9/4/2004,B TECH ARTIFICIAL INTELLIGENCE AND DATA SCIENCE ,VIMALA DEVI,DAYSCHOLAR